{
  "artifacts_sha256": {
    "decisions/ADR-PILOT-SCOPE.md": "41b17de932f912d3f0d8302bde86f2ee49e78bf7043550c9c8ed62c7226c9f75",
    "evidence.jsonl": "08f02f7954d1eefc5eb61c74c2756b664733a1500c4e5ae7d640f8286e04f722",
    "intent.md": "fdc5caec623c5ef6628d978246590e5a31be287886b1b18214fba1f960cdf8d4",
    "legs/LEG-SMALL-FIX.md": "814c438ae8109b4edfb8b29aa21186c5b718b74dbc97c883512a6b27fe812b1f",
    "proposed-graph.json": "0fb13624be54b1999b90fab3ab7d2b4d783c98d69739078199b2b0052be95a56",
    "seam-map.yaml": "201df620e8cef813728e91ba31428f01cc828b2204cf2930f02af253d8c90767",
    "seams/SEAM-SMALL-FIX.md": "011222ae80c9a8cb8a7c41f9b9977752b769101939466c65af12280661f10794",
    "source-recipe.yaml": "0ad8c836025d433ccd7598db85a41481b38664986472e8126be0c9809e99f866",
    "steel-thread.md": "4eb13fd026eb6d48b5f3daa30b89aec67fcd3e91a48400d61abb4b1483bd7fa7",
    "swimlanes/LANE-SMALL-FIX.md": "6833ad8c5811774a9cf80a4e8c5c5cc2c93b29414887cedd4468cb6a453416cc",
    "system-map.md": "1c42801107b87d6ba0a9feca42cc84bde631f399cf2f8496a9704a5ec58dfca4"
  },
  "disposition": "accepted",
  "draft_sha256": "d2f8cb00d175f0bc95fb78b1b8d1dd6bacb728181c6949a039588b519d7ad79c",
  "fixture": false,
  "plan_sha256": "213c6d22df45878f6480ec51ca383c856ed96081eca079e231b0f4417a16b826",
  "reason": "Standing user pilot authorization for the registered fixed scope; controller review is automated and is not a newly observed human intervention.",
  "recipe_sha256": "0ad8c836025d433ccd7598db85a41481b38664986472e8126be0c9809e99f866",
  "reviewed_at": "2026-09-15T12:03:10.681047+00:00",
  "reviewer": "pilot-controller",
  "schema_version": 1,
  "signature": "hmac-taskplan-v1:65938976:540aca203e525c7d75462f792aa6d1d287a06cb060c37a7ae38266bf75749c9f",
  "topology_sha256": "0fb13624be54b1999b90fab3ab7d2b4d783c98d69739078199b2b0052be95a56"
}
